geo,regulation,lawful_basis,opt_out_mechanism,retention_days,sender_identification_required,prior_consent_required,notes
DE,DSGVO + UWG §7,legitimate_interest (Art 6(1)(f) GDPR) for B2B role-based outreach,One-click unsubscribe link in every email + plain-text reply 'unsubscribe',180,Yes - full Impressum incl company address,No - B2B only if relevant to role,UWG §7(2) BGH ruling allows B2B cold email if (a) role-relevant offer (b) sender identified (c) easy opt-out
PL,RODO + UoSE Art 10,legitimate_interest for B2B,One-click unsubscribe + reply opt-out,180,Yes - sender identification mandatory,No for B2B if role-relevant,UoSE Art 10 historically required prior consent - 2018 UODO clarification: B2B role-relevant exempt
UK,UK GDPR + PECR,legitimate_interest (B2B exemption from PECR Reg 22 consent),One-click unsubscribe + plain-text reply,180,Yes - sender identification,No for B2B corporate subscribers (PECR Reg 22 exempts corporate beneficiaries),ICO guidance: PECR consent rule applies only to individual subscribers - corporate sole traders unclear so default opt-in for them
AE,UAE PDPL (Federal Decree-Law 45/2021),legitimate_interest + processing for B2B contract performance preparation,Opt-out link + reply,365,Yes,No for B2B if necessary for proposed transaction,UAE PDPL still maturing - conservative approach: full opt-out + clear sender ID
SA,Saudi PDPL (Royal Decree M/19),legitimate_interest narrow + B2B necessity,Opt-out link + reply,365,Yes - sender + commercial registration,Recommended for high-volume - first wave low volume OK on LI,SDAIA enforcement increasing 2026 - keep audit log of every send + opt-out
NL,AVG (GDPR) + Telecommunicatiewet art 11.7,legitimate_interest (Art 6(1)(f)) for B2B role-based outreach,One-click unsubscribe + plain-text reply,180,Yes - sender identification,No for B2B legal persons if role-relevant,"Wave 1.5. NL spam rule (Telecomwet 11.7) allows B2B to legal persons w/ opt-out; natural-person ZZP'ers (sole traders) are individuals -> default opt-in / skip those. Autoriteit Persoonsgegevens enforces AVG."
US,CAN-SPAM Act + CCPA/CPRA (state),"opt-out model (no prior consent required for B2B)",One-click unsubscribe honored <=10 business days + plain-text reply,n/a (CAN-SPAM has no retention rule; CCPA applies to CA residents),Yes - sender ID + valid physical postal address in every email,No - CAN-SPAM is opt-out not opt-in,"Wave 2 US-OUT. CAN-SPAM far lighter than GDPR: identify sender, real physical address in footer, working opt-out <=10 biz days, no deceptive subject/headers. CCPA/CPRA (California + ~20 states) for website data -> iubenda covers. Need US physical/registered-agent address for footer."
